title,authors,journal,year,pdf_url,pdf_week_code,page_number,entry_index_in_pdf,ingested_at
"® Bullying and physical violence and their association with handgun carrying among youth growing up in rural areas - Ellyson AM, Gause E, Lyons VH, Schleimer JP, Dalve K, Kuklinski MR, Oesterle S, Weybright EH, Rowhani-Rahbar A. Prev. Med. 2023; 167: e107416. Drowning prevention solutions for Iranian nomadic tribes during their seasonal migrations [conference abstract #301] - Moallem AK<br> In: WCDP 2023 Shaping a global strategy. Mobilising for local action. Perth, Australia, December 5-7, 2023. (2023). Leuven, Belgium: International Life Saving Federation, Examining factors affecting driver injury severity in speeding-related crashes: a comparative study across driver age groups","Se C, Champahom T, Jomnonkwao S, Ratanavaraha V",Int. J. Inj. Control Safe. Promot.,2024,https://www.safetylit.org/week/2024/240114.pdf,240114,249,248,2025-09-06T21:15:41.659008
® Nature-based solutions to wildfires in rural landscapes of Southern Europe: let's be fire-smart!,"Regos A, Pais S, Campos JC, Lecina-Diaz J",Int. J. Wildland Fire,2023,https://www.safetylit.org/week/2024/240114.pdf,240114,250,249,2025-09-06T21:15:41.659008
"® Association between child abuse, depression, and school bullying among Chinese secondary school students","Liu L, Wang X, Chen B, Chui WH, Wang X",Int. J. Environ. Res. Public Health,2022,https://www.safetylit.org/week/2024/240114.pdf,240114,251,250,2025-09-06T21:15:41.659008
"® Effectiveness of a cannabis prevention program in school: results of a randomized prospective study - Isensee B, Neumann C, Goecke M, Hanewinkel R. Bundesgesundheitsblatt Gesundheitsforschung Gesundheitsschutz 2024; ePub(ePub): ePub. Elevating and expanding school counselors' roles and voices in the prevention of school violence","Ellington B, Dunbar A, Wachter-Morris C",Prof. Sch. Couns.,2023,https://www.safetylit.org/week/2024/240114.pdf,240114,252,251,2025-09-06T21:15:41.659008
® The association between concussions and vaping among a nationally representative sample of U.S. adolescents,"Leal WE, Boccio CM",Addict. Res. Theory,2023,https://www.safetylit.org/week/2024/240114.pdf,240114,253,252,2025-09-06T21:15:41.659008
"® Built environment and crash severity in school surroundings: a study of Porto Alegre, Brazil","Batistela Torres T, Tessele Nodari C, Larrañaga AM",Lat. Am. Transp. Stud.,2024,https://www.safetylit.org/week/2024/240114.pdf,240114,255,254,2025-09-06T21:15:41.659008
"® Is trust a belief, observation, or state: results from an active inference analysis of driver- automation transitions of control","Wei R, McDonald AD, Garcia A, Mehta RK",Proc. Hum. Factors Ergon. Soc. Annu. Meet.,2023,https://www.safetylit.org/week/2024/240114.pdf,240114,259,258,2025-09-06T21:15:41.659008
"® Proof of concept for a data-driven VR spatial disorientation training tool for Navy pilots - Erickson I, Hidalgo M, Reynolds J, Ficke C, Krumholtz V, Drucker J, Blacker KJ, Pettijohn KA, Burcal CJ. Proc. Hum. Factors Ergon. Soc. Annu. Meet. 2023; 67(1): 1350-1355. Proposal of ACT-R cognitive modeling method for Stroop Task based on quantitative prediction of mental workload","Oh H, Yun Y, Myung R",Proc. Hum. Factors Ergon. Soc. Annu. Meet.,2023,https://www.safetylit.org/week/2024/240114.pdf,240114,260,259,2025-09-06T21:15:41.659008
® Vestibular syncope,"Choi JY, Lee ES, Kim JS",Curr. Opin. Neurol.,2024,https://www.safetylit.org/week/2024/240114.pdf,240114,262,261,2025-09-06T21:15:41.659008
"® Homoprejudiced violence experiences and high-risk sexual behaviors among Chinese men who have sex with men: depression severity and recreational drug usage as potential mediators - Yan X, Ni Y, Lu Y, Wang Q, Tang W, Tan RKJ, Tucker JD, Hall BJ, Baral S, Song H, Zhou Y, Wu D. Arch. Sex. Behav. 2024; ePub(ePub): ePub. Indonesian drowning prevention interventions, a review: protecting vulnerable populations across the nation [conference abstract #293] - Cenderadewi M, Devine S, Franklin RC<br> In: WCDP 2023 Shaping a global strategy. Mobilising for local action. Perth, Australia, December 5-7, 2023. (2023). Leuven, Belgium: International Life Saving Federation, International legal framework on human trafficking and criminal liability on traffickers",Nwala P,Wukari Int. Stud. J.,2023,https://www.safetylit.org/week/2024/240114.pdf,240114,264,263,2025-09-06T21:15:41.659008
"® Priorities to advance water safety and drowning prevention among high-risk and yet hard to reach communities in Uganda: a community needs assessment [conference abstract #292] - Biribawa C, Kalanzi M<br> In: WCDP 2023 Shaping a global strategy. Mobilising for local action. Perth, Australia, December 5-7, 2023. (2023). Leuven, Belgium: International Life Saving Federation, QuickStats: Percentage* of children and adolescents aged 5-17 years who had been the victim of violence or witnessed violence in their neighborhood,(†) by disability status(§) and age group - National Health Interview Survey, United States, 2022(¶)","Weeks JD, Elgaddal N",MMWR Morb. Mortal. Wkly. Rep.,2024,https://www.safetylit.org/week/2024/240114.pdf,240114,265,264,2025-09-06T21:15:41.659008
"® Suicide and Self-Harm 25-Year fatal workplace suicide trends in North Carolina: 1992-2017 - Martin CL, Richey M, Richardson DB, Nocera M, Cantrell J, McClure ES, Martin AT, Marshall SW, Ranapurwala SI. Am. J. Ind. Med. 2024; ePub(ePub): ePub. A Germany-wide survey of caregiving professionals on climate change and mental health of children and adolescents - factors influencing their relevance rating of extreme weather event associated mental health impairments - Hieronimi A, O'Reilly F, Schneider M, Wermuth I, Schulte-Körne G, Lagally L, Böse-O'Reilly S, Danay E. BMC Public Health 2024; 24(1): e120. A randomized control trial of a digital health tool for safer firearm and medication storage for patients with suicide risk - Boggs JM, Quintana LAM, Beck A, Clarke CL, Richardson L, Conley A, Buckingham ET, Richards JE, Betz ME. Prev. Sci. 2024; ePub(ePub): ePub. A retrospective case review of young people referred for paediatric critical care transport following self-harm or a suicide attempt, 2015-2022 [letter] - Borkett-Jones C, Thakur N, Roy P, Clayton-Payne A, Erdunast A, Wilkinson S, Mehta H, Jones AJ. Arch. Dis. Child. 2024; ePub(ePub): ePub. Accounting for diversity in the treatment of suicide and self-injury: a systematic review of the past 50 years of randomized controlled trials - Maria Guzmán EM, LeDuc MK, Cha CB, Goger P, Ng MY, Huang X, Ribeiro JD, Fox KR. Suicide Life Threat. Behav. 2024; ePub(ePub): ePub. Addressing help-seeking, stigma and risk factors for suicidality in secondary schools: short- term and mid-term effects of the HEYLiFE suicide prevention program in a randomized controlled trial","Grosselli L, Knappe S, Baumgärtel J, Lewitzka U, Hoyer J",BMC Public Health,2024,https://www.safetylit.org/week/2024/240114.pdf,240114,266,265,2025-09-06T21:15:41.659008
"® An exploratory qualitative analysis of the Stanford-Templeton convenings on Islam and suicide - Awaad R, Quadri Y, Sifat M, Elzamzamy K, Suleiman K, Rehman O, Husain A, Abdelrehim A, Rushdi R, Belanger CC, Hill TD, Koenig HG. J. Relig. Health 2024; ePub(ePub): ePub. Analysis of drowning fatalities in the Vistula River in years 2011-2020 in the Lesser Poland Voivodeship","Armatys M, Ciuruś J, Grochal N, Leśniak M, Konopka T",Arch. Med. Sadowej Kryminol.,2023,https://www.safetylit.org/week/2024/240114.pdf,240114,267,266,2025-09-06T21:15:41.659008
® Beyond the surface: teachers' perceptions and experiences in cases of non-suicidal self-injury among high school students,"Elyoseph Z, Levkovich I",Omega (Westport),2024,https://www.safetylit.org/week/2024/240114.pdf,240114,268,267,2025-09-06T21:15:41.659008
® Connecting psychosocial and personality characteristics with mental health outcomes. an Italian co-twin control study,"Fagnani C, Gigantesco A, Giacomini G, Medda E",Prev. Med. Rep.,2024,https://www.safetylit.org/week/2024/240114.pdf,240114,269,268,2025-09-06T21:15:41.659008
® Economic activity and suicides: causal evidence from macroeconomic shocks in England and Wales,"Lepori GM, Morgan S, Assarian BA, Mishra T",Soc. Sci. Med.,2023,https://www.safetylit.org/week/2024/240114.pdf,240114,270,269,2025-09-06T21:15:41.659008
® From magical thinking to suicide: understanding emergency physicians' psychological struggle,Iserson KV,Am. J. Emerg. Med.,2024,https://www.safetylit.org/week/2024/240114.pdf,240114,271,270,2025-09-06T21:15:41.659008
"® Incidence of suicidal ideation in a civil servants cohort during the COVID-19 pandemic in Brazil: insights from the ELSA-Brasil study - Bacchi P, Suen P, Fatori D, Razza LB, Afonso L, Klein I, Cavendish B, Moreno ML, Santos IS, Benseñor I, Lotufo P, Brunoni AR. Trends in psychiatry and psychotherapy 2024; ePub(ePub): ePub. Is late-onset suicidal behavior a distinct subtype?","Szanto K, Szucs A, Kenneally LB, Galfalvy HC",Am. J. Geriatr. Psychiatry,2023,https://www.safetylit.org/week/2024/240114.pdf,240114,272,271,2025-09-06T21:15:41.659008
"® Reduced attentional control in individuals with a history of suicide attempts compared to those with suicidal ideation: results from a systematic review and meta-analysis - Escobar LE, Liew M, Yirdong F, Mandelos KP, Ferraro-Diglio SR, Abraham BM, Polanco-Roman L, Benau EM. J. Affect. Disord. 2023; ePub(ePub): ePub. Relations between discrimination, rejection sensitivity, negative affect, and decrements in problem-solving ability following social rejection: an experimental investigation","López RJ, Esposito-Smythers C, Defayette AB, Harris KM, Seibel L, Whitmyre ED",Suicide Life Threat. Behav.,2024,https://www.safetylit.org/week/2024/240114.pdf,240114,274,273,2025-09-06T21:15:41.659008
® Suicide-related cognitions and emotional bias performance in a community sample,"McManimen SL, Hay J, Long C, Bryan CJ, Aase DM",J. Affect. Disord.,2024,https://www.safetylit.org/week/2024/240114.pdf,240114,275,274,2025-09-06T21:15:41.659008
® A 'network of understanding and compassion': a qualitative study of survivor perspectives on unmet needs after traumatic brain injury (TBI) in regional communities,"Hennessy MJ, Sullivan KA",Brain Impair.,2023,https://www.safetylit.org/week/2024/240114.pdf,240114,277,276,2025-09-06T21:15:41.659008
"® Genetic diversity drives extreme responses to traumatic brain injury and post-traumatic epilepsy - Shannon T, Cotter C, Fitzgerald J, Houle S, Levine N, Shen Y, Rajjoub N, Dobres S, Iyer S, Xenakis J, Lynch R, de Villena FPM, Kokiko-Cochran O, Gu B. Exp. Neurol. 2024; ePub(ePub): ePub. Hair fixative traces on footwear - establishing a link between footwear and the victim's hair after kicks to the head","Liechti JM, Lory M",Forensic Sci. Int.,2023,https://www.safetylit.org/week/2024/240114.pdf,240114,278,277,2025-09-06T21:15:41.659008
® A method for analysing the lateral stability of wheeled farm tractors by obstacles on slopes,"Han J, Wang Y, Sun C",Int. J. Veh. Des.,2023,https://www.safetylit.org/week/2024/240114.pdf,240114,280,279,2025-09-06T21:15:41.659008
"® Challenges in promoting bike-bus integration in developing countries: case study of Fortaleza, Brazil","Siqueira MF, Lopes AS, Costa TB, Loureiro CFG",Lat. Am. Transp. Stud.,2023,https://www.safetylit.org/week/2024/240114.pdf,240114,283,282,2025-09-06T21:15:41.659008
® Copula-BN based risk assessment methodology of marine ship collisions,"Li X, Fu Y, Liu Y, Han Z, Zhang R",China Saf. Sci. J.,2023,https://www.safetylit.org/week/2024/240114.pdf,240114,284,283,2025-09-06T21:15:41.659008
® Driving safety of articulated vehicle on a typical interchange,"Luo S, Chen G, Xu J",Int. J. Veh. Safety,2022,https://www.safetylit.org/week/2024/240114.pdf,240114,285,284,2025-09-06T21:15:41.659008
"® Evaluating the impacts of different exit strategies of emergency vehicle preemption on arterial signal coordination: a case study in reno, nevada","Xu J, Tian Z, Wang A",J. Transp. Eng. A: Systems,2023,https://www.safetylit.org/week/2024/240114.pdf,240114,286,285,2025-09-06T21:15:41.659008
® Exploring the timing of disengagement from nondriving related tasks in scheduled takeovers with pre-alerts: an analysis of takeover-related measures,"Bai J, Sun X, Cao S, Wang Q, Wu J",Hum. Factors,2024,https://www.safetylit.org/week/2024/240114.pdf,240114,287,286,2025-09-06T21:15:41.659008
"® Impacts of the COVID-19 pandemic on aquatic-related activities and water safety knowledge within the general Victorian population [conference abstract #302] - Kiss B, Calverley HLM, Strugnell G, Matthews BL<br> In: WCDP 2023 Shaping a global strategy. Mobilising for local action. Perth, Australia, December 5-7, 2023. (2023). Leuven, Belgium: International Life Saving Federation, Improved speed control strategy for mixed traffic flow considering roadside unit","Hao W, Rong D, Zhang Z, Byon YJ, Tian D",J. Transp. Eng. A: Systems,2023,https://www.safetylit.org/week/2024/240114.pdf,240114,289,288,2025-09-06T21:15:41.659008
® Passenger muscle responses in emergency braking events with reclined seating,"Ren L, Kang Y, Tan Z, Jiang C, Hu Y",Sci. Rep.,2024,https://www.safetylit.org/week/2024/240114.pdf,240114,291,290,2025-09-06T21:15:41.659008
"® Proof of concept for a data-driven VR spatial disorientation training tool for Navy pilots - Erickson I, Hidalgo M, Reynolds J, Ficke C, Krumholtz V, Drucker J, Blacker KJ, Pettijohn KA, Burcal CJ. Proc. Hum. Factors Ergon. Soc. Annu. Meet. 2023; 67(1): 1350-1355. Psychosocial risk and work decisions of transport workers: a study","Mościcka-Teske A, Sadłowska-Wrzesińska J, Gajsek B, Stachowiak A",J. Sustain. Devel. Transp. Logistics,2023,https://www.safetylit.org/week/2024/240114.pdf,240114,292,291,2025-09-06T21:15:41.659008
® Research on test scenarios of AEB pedestrian system based on knowledge and accident data,"Qian Y, Qiu Y, Xiao L, Hu W, Dong H",Int. J. Veh. Safety,2022,https://www.safetylit.org/week/2024/240114.pdf,240114,293,292,2025-09-06T21:15:41.659008
® Study on the methods to damp the vehicle motion at high speeds,"Minakawa M, Shibahata Y, Yamamoto M, Kano Y, Yamakado M, Abe M",Trans. Soc. Automot. Eng. Jpn.,2023,https://www.safetylit.org/week/2024/240114.pdf,240114,294,293,2025-09-06T21:15:41.659008
"® A randomized control trial of a digital health tool for safer firearm and medication storage for patients with suicide risk - Boggs JM, Quintana LAM, Beck A, Clarke CL, Richardson L, Conley A, Buckingham ET, Richards JE, Betz ME. Prev. Sci. 2024; ePub(ePub): ePub. A solider and a victim: masculinity, violence, and incels celebration of December 6th","Halpin M, Preston K, Lockyer D, Maguire F",Can. Rev. Sociol.,2024,https://www.safetylit.org/week/2024/240114.pdf,240114,296,295,2025-09-06T21:15:41.659008
"® APPS-S: a tool for measuring the attitudes toward prostitution and women in prostitution in the Spanish population - Terol-Cantero MC, Martin-Aragón Gelabert M, Vázquez Rodríguez C, Velikova Dimitrova M, Navarro Ríos MJ, Manchón López J. Violence Against Women 2024; ePub(ePub): ePub. Assessing awareness, knowledge, and attitude of Saudi mothers regarding shaken baby syndrome in the eastern province of Saudi Arabia: a cross-sectional prospective study","Alghanim FF, Almubayedh TA, Alseba Z",Cureus,2024,https://www.safetylit.org/week/2024/240114.pdf,240114,297,296,2025-09-06T21:15:41.659008
® Black college students' perceptions and conceptualizations of intimate partner violence,"Hall NM, Dyson YD, Minor KA, Jones JM",J. Aggression Maltreat. Trauma,2023,https://www.safetylit.org/week/2024/240114.pdf,240114,298,297,2025-09-06T21:15:41.659008
® Child trafficking: what school nurses need to know,"Peck JL, Rigby KB, Hettenhaus KP, King KY",NASN Sch. Nurse,2024,https://www.safetylit.org/week/2024/240114.pdf,240114,299,298,2025-09-06T21:15:41.659008
® Correction: Participatory approaches and methods in gender equality and gender-based violence research with refugees and internally displaced populations: a scoping review,"Lokot M, Hartman E, Hashmi I",Confl. Health,2024,https://www.safetylit.org/week/2024/240114.pdf,240114,300,299,2025-09-06T21:15:41.659008
® Information sharing between the dental healthcare and child welfare services regarding child maltreatment-a repeated cross-sectional study in Norway,"Åstrøm AN, Berge KG, Birungi N, Brattabø IV",Int. J. Paediatr. Dent.,2024,https://www.safetylit.org/week/2024/240114.pdf,240114,303,302,2025-09-06T21:15:41.659008
"® Manifestations of cruel, inhuman types of behavior and torture of Ukrainian military who died in captivity - Gunas M, Mishalov V, Voroshilov K, Petroshak O, Khyzhniak V, Makarenko O, Morgun A, Gunas V, Perebetiuk A. Leg. Med. (Elsevier) 2024; 67: e102395. Marital rape in India: need for criminalization",Mehrotra A,Indian J. Criminol.,2022,https://www.safetylit.org/week/2024/240114.pdf,240114,304,303,2025-09-06T21:15:41.659008
"® Personality traits and workplace bullying among contract trainee doctors in Malaysia - Ismail H, Dawam D, Muhd Aris NA, Yew SQ, Ahmad H, David CCH, Baharudin MH, Huam ZS, Jamaludin HH. Heliyon 2024; 10(1): e23625. Physical and psychosocial challenges of people with gender dysphoria: a content analysis study","Ghiasi Z, Khazaei F, Khosravi M, Rezaee N",BMC Public Health,2024,https://www.safetylit.org/week/2024/240114.pdf,240114,305,304,2025-09-06T21:15:41.659008
® Profiling offenders and victims of child sexual abuse materials (CSAM) in India,"Arumugham S, Shekhar B",Indian J. Criminol.,2022,https://www.safetylit.org/week/2024/240114.pdf,240114,306,305,2025-09-06T21:15:41.659008
® Rising threats of AI-driven child sexual abuse material,"Krishna S, Dubrosa F, Milanaik R",Pediatrics,2024,https://www.safetylit.org/week/2024/240114.pdf,240114,307,306,2025-09-06T21:15:41.659008
® Subliminal mortality salience does not increase physical strength output in double-blind randomized controlled trial,"Bartenschlager CTJ, Jansen P",Front. Psychol.,2023,https://www.safetylit.org/week/2024/240114.pdf,240114,308,307,2025-09-06T21:15:41.659008
"® ""I worry about my kids' safety when they visit"": mothers' perceptions of father/child post- separation contact in the context of IPV","Tutty LM, Nixon KL, Lorraine Radtke H",Violence Against Women,2024,https://www.safetylit.org/week/2024/240121.pdf,240121,1,1,2025-09-06T21:16:57.312222
"® A systematic review of the literature on community-level child protection in low- and middle- income countries - Ellermeijer REC, Robinson MA, Guevara AF, O'Hare G, Veldhuizen CIS, Wessells M, Reis R, Jordans MJD. Vulnerable Child. Youth Stud. 2023; 18(3): 309-329. A wall of treatments: An integrative problem-solving approach to the prevention of stone- throwing in East Jerusalem","Hasisi B, Itskovich E, Khoury-Kassabri M",Criminol. Public Policy,2023,https://www.safetylit.org/week/2024/240121.pdf,240121,2,2,2025-09-06T21:16:57.312222
"® Associations between cannabis use, opioid misuse and severe psychological distress in adolescents: a cross-sectional school-based study: cannabis, opioids, and mental health","Sampasa-Kanyinga H, Chaput JP, Mougharbel F, Hamilton HA",Drug Alcohol Depend.,2024,https://www.safetylit.org/week/2024/240121.pdf,240121,3,3,2025-09-06T21:16:57.312222
® Childhood maltreatment and non-suicidal self-injury in adolescents: testing a moderated mediating model,"Gong X, Zhang L",J. Interpers. Violence,2024,https://www.safetylit.org/week/2024/240121.pdf,240121,4,4,2025-09-06T21:16:57.312222
"® Distracted and unfocused driving in supervised and unsupervised teen drivers: associations with sleep, inattention, and cognitive disengagement syndrome symptoms","Beanland V, Ritchie C, Ousset C, Galland BC, Schaughency EA",Transp. Res. F Traffic Psychol. Behav.,2024,https://www.safetylit.org/week/2024/240121.pdf,240121,5,5,2025-09-06T21:16:57.312222
"® Experiences of interpersonal violence in sport and perceived coaching style among college athletes - Zogg CK, Runquist EB, Amick M, Gilmer G, Milroy JJ, Wyrick DL, Grimm K, Tuakli-Wosornu YA. JAMA Netw. Open 2024; 7(1): e2350248. Exploring the association between air pollution and active school transportation: perceptions of children and youth in India","Bhawra J, Patel J, Khadilkar A, Katapally TR",Youth (Basel),2023,https://www.safetylit.org/week/2024/240121.pdf,240121,6,6,2025-09-06T21:16:57.312222
"® Fatal accidental drowning in Minnehaha County, South Dakota, 1880-1939","Schulte L, Petersen E, O'Connor H, Mohs J, Reuter A, Travers H",S. Dak. J. Med.,2023,https://www.safetylit.org/week/2024/240121.pdf,240121,7,7,2025-09-06T21:16:57.312222
"® Homicide of children through violence, abuse or neglect in a small Nordic welfare society",Freysteinsdóttir FJ,Nord. Welf. Res.,2023,https://www.safetylit.org/week/2024/240121.pdf,240121,8,8,2025-09-06T21:16:57.312222
® Intimate partner violence during pregnancy against adolescents in sub-Saharan Africa: a systematic review,"Adjimi Nyemgah C, Ranganathan M, Stöckl H",Inj. Prev.,2024,https://www.safetylit.org/week/2024/240121.pdf,240121,9,9,2025-09-06T21:16:57.312222
® Minor-focused sextortion by adult strangers: a crime script analysis of newspaper and court cases,"O'Malley RL, Holt K, Holt TJ, Rodriguez J",Criminol. Public Policy,2023,https://www.safetylit.org/week/2024/240121.pdf,240121,10,10,2025-09-06T21:16:57.312222
® Pediatrics. Consultation in pediatric for children exposed to domestic violence,"Sangsue J, Sandoz V, Kabwiku E, Depallens S",Rev. Med. Suisse,2024,https://www.safetylit.org/week/2024/240121.pdf,240121,11,11,2025-09-06T21:16:57.312222
® Preventing selfie-related incidents: taking a public health approach to reduce unnecessary burden on emergency medicine services,"Cornell S, Brander RW, Peden AE",Emerg. Med. Australas.,2023,https://www.safetylit.org/week/2024/240121.pdf,240121,12,12,2025-09-06T21:16:57.312222
"® Sleep measures as a predictor of suicidal ideation among high-risk adolescents - Ratzon R, Reiter J, Goltser-Dubner T, Segman R, Weisstub EG, Benarroch F, Ran SRZ, Kianski E, Giesser R, Weinberg PB, Ben-Ari A, Sela Y, Nitsan MB, Lotan A, Shalev A. Eur. Child Adolesc. Psychiatry 2024; ePub(ePub): ePub. Sleep quality impacts the link between reactivity to uncertain threat and anxiety and alcohol use in youth","Jenkins KC, Difatta J, Jones EE, Kreutzer KA, Way BM, Phan KL, Gorka SM",Psychophysiology,2024,https://www.safetylit.org/week/2024/240121.pdf,240121,13,13,2025-09-06T21:16:57.312222
"® The association between childhood trauma and tobacco smoking in patients with psychosis, unaffected siblings, and healthy controls - de With J, van der Heijden S, van Amelsvoort T, Daemen M, Simons C, Alizadeh B, van Aalst D, de Haan L, Vermeulen J, Schirmbeck F. Eur. Arch. Psychiatry Clin. Neurosci. 2024; ePub(ePub): ePub. The effect of the 'Swim Reaper' program on water safety awareness, drowning mortality and morbidity among males aged 15-34 years in Aotearoa, New Zealand","Peden AE, Williamson S, Fozard F, Hanly M, Moller H",J. Saf. Res.,2023,https://www.safetylit.org/week/2024/240121.pdf,240121,14,14,2025-09-06T21:16:57.312222
® The prevalence of child sexual abuse with online sexual abuse added,"Finkelhor D, Turner H, Colburn D",Child Abuse Negl.,2024,https://www.safetylit.org/week/2024/240121.pdf,240121,15,15,2025-09-06T21:16:57.312222
® A novel home-based telerehabilitation program targeting fall prevention in Parkinson disease: a preliminary trial,"Afshari M, Hernandez AV, Joyce JM, Hauptschein AW, Trenkle KL, Stebbins GT, Goetz CG",Neurol. Clin. Pract.,2024,https://www.safetylit.org/week/2024/240121.pdf,240121,16,16,2025-09-06T21:16:57.312222
"® Improved accuracy and efficiency of primary care fall risk screening of older adults using a machine learning approach - Song W, Latham NK, Liu L, Rice HE, Sainlaire M, Min L, Zhang L, Thai T, Kang MJ, Li S, Tejeda C, Lipsitz S, Samal L, Carroll DL, Adkison L, Herlihy L, Ryan V, Bates DW, Dykes PC. J. Am. Geriatr. Soc. 2024; ePub(ePub): ePub. Improving safety performance of construction workers through cognitive function training","Ahn S, Moon H, Chung ST",Int. J. Adv. Smart Converg.,2023,https://www.safetylit.org/week/2024/240121.pdf,240121,17,17,2025-09-06T21:16:57.312222
"® Age: Infants and Children ""Bike trains"" to school to increase cycling adoption and bikeability: results from the Lisbon city program","Bernardino J, Sobral R, Vieira L, Henriques IC, Knapic S, Cambão M",Transp. Res. Proc.,2023,https://www.safetylit.org/week/2024/240121.pdf,240121,18,18,2025-09-06T21:16:57.312222
"® Adverse childhood experiences, cognitive functioning, depression, and anxiety in adulthood - Bing-Canar H, Stocks JK, Khan H, Rauch AA, Obolsky MA, Lapitan-Moore F, Phillips MS, Soble JR, Pliskin NH, Song W, Resch ZJ. Psychol. Trauma 2024; ePub(ePub): ePub. An evaluation of the use of the child and adolescent scale of participation (CASP) to measure social participation after pediatric ABI in a specialist service in East Anglia","Wolters L, White WF, Ellerton H, Watson S, Psaila K, Ford C, Gracey F",Dev. Neurorehabil.,2024,https://www.safetylit.org/week/2024/240121.pdf,240121,19,19,2025-09-06T21:16:57.312222
"® Childhood maltreatment and engaging in NSSI for automatic-negative reinforcement: the mediating role of alexithymia and moderating role of help-seeking attitudes - Ke J, Wu J, Zhao W, Wang Y, Zhang Z, Tong Q, Guo Z, Wen Y, Li N, Yu F, Xie S, Zhu C, Wang K, Zhang L. J. Affect. Disord. 2024; ePub(ePub): ePub. Childhood maltreatment and non-suicidal self-injury in adolescents: testing a moderated mediating model","Gong X, Zhang L",J. Interpers. Violence,2024,https://www.safetylit.org/week/2024/240121.pdf,240121,20,20,2025-09-06T21:16:57.312222
