title,authors,journal,year,pdf_url,pdf_week_code,page_number,entry_index_in_pdf,ingested_at
® A decade of firearm injuries: have we improved?,"Hatfield SA, Medina S, Gorman E, Barie PS, Winchell RJ, Villegas CV",J. Trauma Acute Care Surg.,2024,https://www.safetylit.org/week/2024/240121.pdf,240121,192,192,2025-09-06T21:16:57.312222
® A wall of treatments: An integrative problem-solving approach to the prevention of stone- throwing in East Jerusalem,"Hasisi B, Itskovich E, Khoury-Kassabri M",Criminol. Public Policy,2023,https://www.safetylit.org/week/2024/240121.pdf,240121,194,194,2025-09-06T21:16:57.312222
® An insight on gender-based violence,"Ochani K, Siddiqui A, Ochani S",Health Sci. Rep.,2024,https://www.safetylit.org/week/2024/240121.pdf,240121,195,195,2025-09-06T21:16:57.312222
"® Assessment of over-the-head resuscitation method in an inflatable rescue boat sailing at full speed: a non-inferiority pilot study - Barcala-Furelos R, Carracedo-Rodríguez E, Lorenzo-Martínez M, Alonso-Calvete A, Otero-Agra M, Jorge-Soto C. Am. J. Emerg. Med. 2023; 70: 70-74. Assessment of self-injurious behavior and oral injuries among adolescents in shelter care: a cross-sectional study","Rodolfo Tavares de Melo J, Brito Vasconcelos G, Kelly Barreira A, Colares V",Vulnerable Child. Youth Stud.,2023,https://www.safetylit.org/week/2024/240121.pdf,240121,196,196,2025-09-06T21:16:57.312222
® Banditry and gender-based volience in North-West Nigeria,"Kums SN, Kwede CI",Wukari Int. Stud. J.,2023,https://www.safetylit.org/week/2024/240121.pdf,240121,197,197,2025-09-06T21:16:57.312222
® Cannabis-induced psychotic disorder with onset during withdrawal: a brief report of emerging evidence,"Cohen J, Petitjean H, Blasco MB, Mizrahi R",Acta Neuropsyciatr.,2024,https://www.safetylit.org/week/2024/240121.pdf,240121,198,198,2025-09-06T21:16:57.312222
® Close passes caught on camera - how knowledge and behavioural norms relate to perceptions of liability when cars overtake cyclists,"Cubbin W, van Paridon K, Keyes H, Timmis M",Transp. Res. F Traffic Psychol. Behav.,2024,https://www.safetylit.org/week/2024/240121.pdf,240121,199,199,2025-09-06T21:16:57.312222
® Evaluating YOLO architectures for detecting road killed endangered Brazilian animals,"Ferrante GS, Vasconcelos Nakamura LH, Sampaio S, Filho GPR, Meneguette RI",Sci. Rep.,2024,https://www.safetylit.org/week/2024/240121.pdf,240121,204,204,2025-09-06T21:16:57.312222
"® Exploring the relationship between attributional style measured in virtual reality and bullying among children at familial high risk of schizophrenia or bipolar disorder compared with controls - Søndergaard A, Gregersen M, Wilms M, Brandt JM, Hjorthøj C, Ohland J, Rohd SB, Hemager N, Andreassen AK, Knudsen CB, Veddum L, Krantz MF, Greve A, Bliksted V, Mors O, Valmaggia L, Thorup AE, Nordentoft M. Schizophr. Res. 2024; 264: 354-361. Exploring the relationship between sleep and aggression in adolescents: a cross sectional study using the UK Millennium cohort study","McCaffrey C, McClure J, Singh S, Melville CA",Clin. Child Psychol. Psychiatry,2024,https://www.safetylit.org/week/2024/240121.pdf,240121,205,205,2025-09-06T21:16:57.312222
"® Group climate in residential youth care: development and validation of the group climate instrument-revised - van der Helm GHPP, Roest JJ, Dekker AL, van Miert VSL, Kuiper CHZ, Stams GJJM. Int. J. Offender Ther. Comp. Criminol. 2024; ePub(ePub): ePub. Gun owners views on gun control in the United States: a qualitative study",Peterson T,Psychol. Rep.,2024,https://www.safetylit.org/week/2024/240121.pdf,240121,207,207,2025-09-06T21:16:57.312222
"® How does parental monitoring reduce adolescent substance use? Preliminary tests of two potential mechanisms - Pelham WE, Tapert SF, Gonzalez MR, Ahiarakwe U, Patel H, Davis IS, Meruelo A, Van Rinsveld AM, Marshall AT, Dick AS, Guillaume M, Dowling GJ, Baskin-Sommers A, Brown SA. J. Stud. Alcohol Drugs 2024; ePub(ePub): ePub. How manoeuvre information via auditory (spatial and beep) and visual UI can enhance trust and acceptance in automated driving","Kim S, van Egmond R, Happee R",Transp. Res. F Traffic Psychol. Behav.,2024,https://www.safetylit.org/week/2024/240121.pdf,240121,208,208,2025-09-06T21:16:57.312222
"® If we build it together, will they use it? A mixed-methods study evaluating the implementation of Prep-to-Play PRO: an injury prevention programme for women's elite Australian Football - Bruder AM, Patterson BE, Crossley KM, Mosler AB, Haberfield MJ, Hägglund M, Culvenor AG, Cowan SM, Donaldson A. Br. J. Sports Med. 2024; ePub(ePub): ePub. Immigration and police perceptions of a ""war on police"" in a U.S.-Mexico border town","Luo F, Carey MT, Updegrove AH, Cho A",Int. Criminol.,2023,https://www.safetylit.org/week/2024/240121.pdf,240121,209,209,2025-09-06T21:16:57.312222
"® Incidence trajectories of psychiatric disorders after assault, injury, and bereavement - Chen Y, Shen Q, Lichtenstein P, Gradus JL, Arnberg FK, Larsson H, D'Onofrio BM, Fang F, Song H, Valdimarsdottir UA. JAMA Psychiatry 2024; ePub(ePub): ePub. Increasing injury intensity among 6500 violent deaths in the state of Maryland - Sakran JV, Lunardi N, Mehta A, Ezzeddine HM, Chammas M, Fransman R, Byrne JP, Stevens K, Efron D. J. Am. Coll. Surg. 2024; ePub(ePub): ePub. Individual, family, and environmental correlates of fundamental motor skills among school- aged children: a cross-sectional study in China","He Y, Zhou L, Liang W, Liu Q, Liu W, Wang S",BMC Public Health,2024,https://www.safetylit.org/week/2024/240121.pdf,240121,210,210,2025-09-06T21:16:57.312222
® Mental health problems among adolescents during the COVID-19 pandemic: a repeated cross- sectional study from Sweden,"Källmén H, Hallgren M",Scand. J. Public Health,2024,https://www.safetylit.org/week/2024/240121.pdf,240121,213,213,2025-09-06T21:16:57.312222
® Monitoring driver drowsiness in partially automated vehicles: added value from combining postural and physiological indicators,"Perrotte G, Bougard C, Portron A, Vercher JL",Transp. Res. F Traffic Psychol. Behav.,2024,https://www.safetylit.org/week/2024/240121.pdf,240121,214,214,2025-09-06T21:16:57.312222
"® National and state-level trends in the availability of mental health treatment services tailored to individuals ordered to treatment by a court: United States, 2016, 2018, and 2020 - Pro G, Horton H, Tody B, Gu M, Washington T, Williams A, Gorvine MM, Johnson OD, Lovelady N, Jackson T, Ray A, Montgomery B, Zaller N. Soc. Psychiatry Psychiatr. Epidemiol. 2024; ePub(ePub): ePub. National trends and clinical outcomes after scooter injury in the US: 2016-2020","Cho NY, Kim S, Tran Z, Hadaya J, Ali K, Kronen E, Burruss S, Benharash P",J. Am. Coll. Surg.,2024,https://www.safetylit.org/week/2024/240121.pdf,240121,215,215,2025-09-06T21:16:57.312222
"® Open-source tools for road user safety assessment from the VIRTUAL project - Linder A, Heinzl P, Iraeus J, John JD, Keller A, Klug C, Lackner C, Levallois I, Svensson M, Schmitt KU, Trummler L, Xu JC. Transp. Res. Proc. 2023; 72: 423-430. Optimal UAV hangar locations for emergency services considering restricted areas","Braßel H, Zeh T, Fricke H, Eltner A",Drones,2023,https://www.safetylit.org/week/2024/240121.pdf,240121,216,216,2025-09-06T21:16:57.312222
® Perinatal depression and risk of suicidal behavior,"Yu H, Shen Q, Bränn E, Yang Y, Oberg AS, Valdimarsdottir UA, Lu D",JAMA Netw. Open,2024,https://www.safetylit.org/week/2024/240121.pdf,240121,217,217,2025-09-06T21:16:57.312222
® Primary prevention of prescription stimulant misuse in first-year college students,"Antshel KM, Park A, Maisto S, Faraone SV",J. Am. Coll. Health,2024,https://www.safetylit.org/week/2024/240121.pdf,240121,219,219,2025-09-06T21:16:57.312222
® Research following trauma in minority ethnic and faith communities: lessons from a study of the psychosocial sequelae of the Christchurch mosque terror attacks,"Sulaiman-Hill R, Porter R, Schluter P, Beaglehole B, Dean S, Tanveer S, Boden J, Bell C",BJPsych Open,2024,https://www.safetylit.org/week/2024/240121.pdf,240121,220,220,2025-09-06T21:16:57.312222
® Same sex-attraction as a predictor of suicide and self-harm behaviours: the role of bullying and social support,"Tetkovic I, Parsons S, White SR, Bowes L",J. Affect. Disord.,2024,https://www.safetylit.org/week/2024/240121.pdf,240121,221,221,2025-09-06T21:16:57.312222
"® Social norms, diffusion, and women's risk of intimate partner violence in Nepal: impact assessment of a social and behavior change communication intervention (Change Starts at home) - Clark CJ, Ferguson G, Subedi S, Lad A, Hadd AR, Shrestha B, Shervinskie A, Tomar S, Baker H. SSM Popul. Health 2024; 25: e101583. Societal discrimination and mental health among transgender athletes: a systematic review and meta-analysis","Chan ASW, Choong A, Phang KC, Leung LM, Tang PMK, Yan E",BMC Psychol.,2024,https://www.safetylit.org/week/2024/240121.pdf,240121,222,222,2025-09-06T21:16:57.312222
® Substance use among international college students in the Netherlands: an exploratory study,"van den Bos A, Blaauw E, Venema S, Bieleman B",Youth (Basel),2024,https://www.safetylit.org/week/2024/240121.pdf,240121,223,223,2025-09-06T21:16:57.312222
® The effect of technological readiness dimensions on the adoption of autonomous vehicles: focusing on behavioral reasoning theory,"Hong E, Park JK",Transp. Res. F Traffic Psychol. Behav.,2024,https://www.safetylit.org/week/2024/240121.pdf,240121,225,225,2025-09-06T21:16:57.312222
® The impact of intimate partner violence on women in criminal courts: beyond the victim- survivor dichotomy,"Aizpitarte A, Tamarit-Sumalla JM, Hernández-Hidalgo P, Arantegui Arràez L",Vict. Offender,2023,https://www.safetylit.org/week/2024/240121.pdf,240121,226,226,2025-09-06T21:16:57.312222
"® The Signature Biobank: a longitudinal biopsychosocial repository of psychiatric emergency patients - Kerr P, Le Page C, Giguère C, Marin MF, Trudel-Fitzgerald C, Romain AJ, Taschereau-Dumouchel V, Ouellet-Morin I, Lecomte T, Potvin S, Geoffrion S, Sasseville M, Caihol L, Lipp O, Pelletier JF, Dumais A, Lesage A, Labelle R, Lavoie M, Godbout R, Vincent P, Boissonneault J, Findlay H, Lupien SJ, Guay S, Juster RP, Consortium S. Psychiatry Res. 2024; 332: e115718. The social determinants of mental health and disorder: evidence, prevention and recommendations - Kirkbride JB, Anglin DM, Colman I, Dykxhoorn J, Jones PB, Patalay P, Pitman A, Soneson E, Steare T, Wright T, Griffiths SL. World Psychiatry 2024; 23(1): 58-90. The social dynamics of adolescent co-offending","Ashton SA, Bussu A",Youth Justice,2023,https://www.safetylit.org/week/2024/240121.pdf,240121,228,228,2025-09-06T21:16:57.312222
® Training road users for future mixed automated traffic contexts: a practical framework for creating evidence-based education and awareness schemes,"Nugent MM, Chalkia E, Baldanzini N",Transp. Res. Proc.,2023,https://www.safetylit.org/week/2024/240121.pdf,240121,229,229,2025-09-06T21:16:57.312222
® Variability in occult injury screening among siblings/household contacts of physical abuse victims,"Deutsch SA, Einspahr S, Almeida D, Vandergrift D, Loiselle C, De Jong A",Pediatr. Emerg. Care,2024,https://www.safetylit.org/week/2024/240121.pdf,240121,230,230,2025-09-06T21:16:57.312222
® Why did US urban homicide spike in 2020? A cross-sectional data analysis for the largest American cities,"Fazel-Zarandi MM, Barnett A",Risk Anal.,2024,https://www.safetylit.org/week/2024/240121.pdf,240121,231,231,2025-09-06T21:16:57.312222
"® A glacial lake outburst floods hazard assessment in the Patagonian Andes combining inventory data and case-studies - Colavitto B, Allen S, Winocur D, Dussaillant A, Guillet S, Muñoz-Torrero Manchado A, Gorsic S, Stoffel M. Sci. Total Environ. 2024; ePub(ePub): ePub. A methodology for setting credible speed limits based on numerical analyses and driving simulator experiments - Montella A, Calvi A, D'Amico F, Ferrante C, Galante F, Mauriello F, Rella Riccardi M, Scarano A. Transp. Res. F Traffic Psychol. Behav. 2024; 100: 289-307. A network analysis of Hurricane Maria-related traumatic stress and substance use among Puerto Rican youth - Vázquez AL, Flores CMN, Feinberg DK, González JC, Young J, Stewart RW, Orengo-Aguayo RE. J. Trauma. Stress 2024; ePub(ePub): ePub. A new scale for evaluating home accidents: home accidents awareness scale for mothers with 0-3-year-old children","Gulbetekin E, Tufekci FG",Med. Bull. Haseki Hosp.,2023,https://www.safetylit.org/week/2024/240121.pdf,240121,232,232,2025-09-06T21:16:57.312222
"® Building a less intimidating cycling environment for women: a structural equation modeling analysis based on a VR-based laboratory experiment - Khademi N, Naeinizadeh M, Firoozi Yeganeh S, Behmanesh A, Ekramifard A, Chaiyasarn K, Zheng Z, Arbabpour Bidgoli M, Azarmi H, Tarvirdizadeh B, Hadi A. Transp. Res. F Traffic Psychol. Behav. 2024; 100: 431-457. Can we trust our eyes? Interpreting the misperception of road safety from street view images and deep learning","Yu X, Ma J, Tang Y, Yang T, Jiang F",Accid. Anal. Prev.,2024,https://www.safetylit.org/week/2024/240121.pdf,240121,234,234,2025-09-06T21:16:57.312222
® Control of floating object directions on rip current at beaches by using deflectors,"Hassan RMA, Ibrahim MA, Iskander MM, Mostafa MA",Int. J. Eng .Trends Tech.,2023,https://www.safetylit.org/week/2024/240121.pdf,240121,235,235,2025-09-06T21:16:57.312222
"® Disaster preparedness in a resettled refugee community: qualitative findings - Greenky D, Hassan S, Nerhood K, O'Connor MH, Pozzo N, Prasad P, Schoendorf E, Soti S, Murray B. Disaster Med. Public Health Prep. 2024; 18: e2. Disentangling effects of remote mild traumatic brain injury characteristics and posttraumatic stress on processing speed and executive function in veterans","Thompson RC, Melinder MRD, Daly HA, Warren SL",J. Neuropsychol.,2024,https://www.safetylit.org/week/2024/240121.pdf,240121,236,236,2025-09-06T21:16:57.312222
® Drowning risk assessment at a nature-based tourism destination in Malaysia: a case study of Chamang Forest-Eco Park,"Abidin ZAZ, Kelana SR, Ramlan MA, Jumaat NJ, Aziz A",Malays. For.,2023,https://www.safetylit.org/week/2024/240121.pdf,240121,237,237,2025-09-06T21:16:57.312222
® Evaluation of the vehicle behaviour when not responding to the take-over request of Tesla Autopilot and Volkswagen Travel Assist,"Bauder M, Paula D, Kubjatko T, Schweiger HG",Transp. Res. Proc.,2023,https://www.safetylit.org/week/2024/240121.pdf,240121,238,238,2025-09-06T21:16:57.312222
® Farmer-herders conflicts in Nigeria: its challenges and interventions,"Mazeli MO, Side B",Wukari Int. Stud. J.,2023,https://www.safetylit.org/week/2024/240121.pdf,240121,239,239,2025-09-06T21:16:57.312222
® How manoeuvre information via auditory (spatial and beep) and visual UI can enhance trust and acceptance in automated driving,"Kim S, van Egmond R, Happee R",Transp. Res. F Traffic Psychol. Behav.,2024,https://www.safetylit.org/week/2024/240121.pdf,240121,240,240,2025-09-06T21:16:57.312222
"® Impulsivity and psychiatric diagnoses as mediators of suicidal ideation and suicide attempts among veterans with traumatic brain injury - Aaronson AL, Smith B, Krese K, Barnhart M, Adamson M, de Wit H, Philip NS, Brenner LA, Bender-Pape T, Herrold AA. J. Neuropsychiatry Clin. Neurosci. 2024; ePub(ePub): ePub. In-vehicle technology to prevent drunk driving: public acceptance required for successful deployment","Kingsley K, da Silva FP, Strassburger R",Transp. Res. Proc.,2023,https://www.safetylit.org/week/2024/240121.pdf,240121,241,241,2025-09-06T21:16:57.312222
"® Mental health impacts of climate change and extreme weather events on mothers - Pardon MK, Dimmock J, Chande R, Kondracki A, Reddick B, Davis A, Athan A, Buoli M, Barkin JL. Eur. J. Psychotraumatol. 2024; 15(1): e2296818. Mental health problems among adolescents during the COVID-19 pandemic: a repeated cross- sectional study from Sweden","Källmén H, Hallgren M",Scand. J. Public Health,2024,https://www.safetylit.org/week/2024/240121.pdf,240121,242,242,2025-09-06T21:16:57.312222
® Risk-taking and self-harm behaviors as markers of adolescent borderline personality disorder,"Blaha Y, Cavelti M, Lerch S, Steinhoff A, Koenig J, Kaess M",Eur. Child Adolesc. Psychiatry,2024,https://www.safetylit.org/week/2024/240121.pdf,240121,245,245,2025-09-06T21:16:57.312222
® Study on the mechanism of safety risk propagation in subway construction projects,"Han Y, Shen J, Zhu X, An B, Liu F, Bao X",Sustainability (Basel),2024,https://www.safetylit.org/week/2024/240121.pdf,240121,246,246,2025-09-06T21:16:57.312222
® Towards a roadmap for user acceptance path to vehicle automation,"Gaitanidou E, Loukea M, Bekiaris E",Transp. Res. Proc.,2023,https://www.safetylit.org/week/2024/240121.pdf,240121,248,248,2025-09-06T21:16:57.312222
® What do drivers prefer? A field study on longitudinal and lateral driving automation,"Ebinger N, Neuhuber N, Moser J, Trösterer S, Stocker A",Transp. Res. Proc.,2023,https://www.safetylit.org/week/2024/240121.pdf,240121,249,249,2025-09-06T21:16:57.312222
® Spatial analysis of data frequency and severity of rural accidents,"Shafabakhsh GA, Famili A, Akbari M",Transp. Lett.,2023,https://www.safetylit.org/week/2024/240121.pdf,240121,251,251,2025-09-06T21:16:57.312222
® Drowning prevention through school health education. Evaluation of the SOS 112 pilot project,"Peixoto-Pino L, Barcala-Furelos R, Lorenzo-Martínez M, Rodríguez-Núñez A",Rev. Esp. Salud Publica,2023,https://www.safetylit.org/week/2024/240121.pdf,240121,252,252,2025-09-06T21:16:57.312222
® The independent and joint effect of socioeconomic status and multiracial status on the prevalence and frequency of substance use and depression among U.S. adolescents,"Hai AH, Lopez-Quintero C, Elton A, Curran L, Bo A",Addict. Behav.,2024,https://www.safetylit.org/week/2024/240121.pdf,240121,254,254,2025-09-06T21:16:57.312222
® Emotional context effects on the rating of ambiguous facial expressions in depression and schizophrenia spectrum disorders,"Kramer M, Stetter M, Heinisch C, Baumgart P, Brüne M, Mavrogiorgou P, Juckel G",Psychiatry,2024,https://www.safetylit.org/week/2024/240121.pdf,240121,257,257,2025-09-06T21:16:57.312222
® Friend or foe? A special approach to overlay bicycle and scooter trajectories Fully convolutional neural network for vehicle speed and emergency-brake prediction,"Itu R, Danescu R",Sensors (Basel),2023,https://www.safetylit.org/week/2024/240121.pdf,240121,258,258,2025-09-06T21:16:57.312222
"® Improved accuracy and efficiency of primary care fall risk screening of older adults using a machine learning approach - Song W, Latham NK, Liu L, Rice HE, Sainlaire M, Min L, Zhang L, Thai T, Kang MJ, Li S, Tejeda C, Lipsitz S, Samal L, Carroll DL, Adkison L, Herlihy L, Ryan V, Bates DW, Dykes PC. J. Am. Geriatr. Soc. 2024; ePub(ePub): ePub. In-vehicle technology to prevent drunk driving: public acceptance required for successful deployment","Kingsley K, da Silva FP, Strassburger R",Transp. Res. Proc.,2023,https://www.safetylit.org/week/2024/240121.pdf,240121,259,259,2025-09-06T21:16:57.312222
® Narrow passage interactions: a UK-based exploratory survey study to identify factors affecting driver decision-making,"Youssef P, Plant KL, Waterson B",Transp. Res. F Traffic Psychol. Behav.,2024,https://www.safetylit.org/week/2024/240121.pdf,240121,260,260,2025-09-06T21:16:57.312222
® Simulation of pedestrian and cyclist underpass to reduce risky behaviour and traffic violations - a case study level crossing Trnava in Croatia,"Grabušić S, Barić D",Transp. Res. Proc.,2023,https://www.safetylit.org/week/2024/240121.pdf,240121,261,261,2025-09-06T21:16:57.312222
® Understanding risky driving among motorized two-wheeler drivers: the role of time-related anxiety and impunctuality,"Gupta M, Velaga NR, Oviedo-Trespalacios O",Transp. Policy,2024,https://www.safetylit.org/week/2024/240121.pdf,240121,262,262,2025-09-06T21:16:57.312222
"® Associations among sexual assault, posttraumatic stress, drinking to cope with anxiety, and alcohol use based on gender identity and sexual orientation - Kilimnik CD, García-Ramírez G, Salamanca NK, Mazzone GM, Mullican KN, Davis KC, Orchowski LM, Leone RM, Kaysen D, Gilmore AK. Alcohol (Hanover) 2023; 47(11): 2169-2183. Banditry and gender-based volience in North-West Nigeria","Kums SN, Kwede CI",Wukari Int. Stud. J.,2023,https://www.safetylit.org/week/2024/240121.pdf,240121,263,263,2025-09-06T21:16:57.312222
® Manual scavenging and the right to health in India - social and medicolegal perspectives,"Mala J, Byard RW, Kaur N",Med. Sci. Law,2023,https://www.safetylit.org/week/2024/240121.pdf,240121,265,265,2025-09-06T21:16:57.312222
"® The relationship between depression, anxiety and stress levels on suicidal behavior in patients with schizophrenia","Taktak, Seki Öz H",Psychiatry Clin. Psychopharm.,2023,https://www.safetylit.org/week/2024/240121.pdf,240121,267,267,2025-09-06T21:16:57.312222
® A metabolomics-based study on the discriminative classification models and toxicological mechanism of estazolam fatal intoxication,"Dai X, Bai R, Xie B, Xiang J, Miao X, Shi Y, Yu F, Cong B, Wen D, Ma C",Metabolites (Basel),2023,https://www.safetylit.org/week/2024/240121.pdf,240121,268,268,2025-09-06T21:16:57.312222
® Are vulnerable adolescents more prone to smartphone and Internet addiction? A cross- sectional study among adolescents in Switzerland,"Siwiak A, Suris JC, Chok L, Stadelmann S, Corre T, Barrense-Dias Y",Vulnerable Child. Youth Stud.,2023,https://www.safetylit.org/week/2024/240121.pdf,240121,269,269,2025-09-06T21:16:57.312222
"® Differentiating suicide from homicide in sharp-force fatalities with stab and/or incised wounds: a scoping review - AlGheryafi ZF, Alnasser FF, Almukhtar FH, Aldajani FA, Al Qassim FH, Al Zakaria ZM, Alshammari SO, Menezes RG. Leg. Med. (Elsevier) 2023; 67: e102388. Do self-processes and parenting mediate the effects of anxious parents' psychopathology on youth depression and suicidality?","Zhang N, Smith IC, Ginsburg G",Child Psychiatry Hum. Dev.,2024,https://www.safetylit.org/week/2024/240121.pdf,240121,271,271,2025-09-06T21:16:57.312222
"® Extreme risk protection orders in the post-Bruen age: weighing evidence, scholarship, and rights for a promising gun violence prevention tool","Frattaroli S, Willinger A",Fordham Urban Law J.,2023,https://www.safetylit.org/week/2024/240121.pdf,240121,272,272,2025-09-06T21:16:57.312222
"® Lifetime trauma, symptoms of psychological disturbance, and suicidal ideation among university students in Malaysia","Ghazali SR, Chen YY, Mohamad M, Yein LP, Razali ZA, Pauzi N, Majani AF",Curr. Psychol.,2023,https://www.safetylit.org/week/2024/240121.pdf,240121,273,273,2025-09-06T21:16:57.312222
"® Mortality and lithium-protective effects after first-episode mania diagnosis in bipolar disorder: a nationwide retrospective cohort study in Taiwan - Carvalho AF, Hsu CW, Vieta E, Solmi M, Marx W, Berk M, Liang CS, Tseng PT, Wang LJ. Psychother. Psychosom. 2024; ePub(ePub): ePub. Mortality and suicidality in veterans health administration patients with newly-identified early episode psychosis - Bowersox NW, Smith CM, Austin K, Bradford DW, Browne J, Nelson SM, Szymanski BR, Glynn SM. Schizophr. Res. 2024; 264: 362-369. Mutual aid groups for loneliness, psychosocial disability, and continuity of care","Agudelo-Hernández F, Guapacha-Montoya M, Rojas-Andrade R",Community Ment. Health J.,2024,https://www.safetylit.org/week/2024/240121.pdf,240121,274,274,2025-09-06T21:16:57.312222
"® Pathways of depressive symptoms to self-harm and suicide warning signs during COVID-19 pandemic: the role of anxiety and related distress, dysfunction and somatization","Chainé SM, Palafox G, García RR, Landgrave PA, Montoya AL, Romero VF, Gispert MAI",J. Affect. Disord.,2024,https://www.safetylit.org/week/2024/240121.pdf,240121,275,275,2025-09-06T21:16:57.312222
"® Smartphone-based treatment in psychiatry: a systematic review - Faurholt-Jepsen M, Tønning ML, Kessing LV<br> In: Digital Mental Health: A Practitioner's Guide. Passos IC, Rabelo- da-Ponte FD, Kapczinski F; eds. (2023). Cham: Springer International Publishing, 69-94 pages. Societal discrimination and mental health among transgender athletes: a systematic review and meta-analysis","Chan ASW, Choong A, Phang KC, Leung LM, Tang PMK, Yan E",BMC Psychol.,2024,https://www.safetylit.org/week/2024/240121.pdf,240121,277,277,2025-09-06T21:16:57.312222
"® The social determinants of mental health and disorder: evidence, prevention and recommendations - Kirkbride JB, Anglin DM, Colman I, Dykxhoorn J, Jones PB, Patalay P, Pitman A, Soneson E, Steare T, Wright T, Griffiths SL. World Psychiatry 2024; 23(1): 58-90. The spatial (in)stability of mental health calls for police service",Koziarski J,Criminol. Public Policy,2023,https://www.safetylit.org/week/2024/240121.pdf,240121,279,279,2025-09-06T21:16:57.312222
® Caregiver report of social-emotional functioning in infants and young children after inflicted traumatic brain injury,"Connery AK, Lee AH, Peterson RL, Dichiaro M, Chiesa A",Child Neuropsychol.,2024,https://www.safetylit.org/week/2024/240121.pdf,240121,280,280,2025-09-06T21:16:57.312222
"® Longitudinal brain perfusion and symptom presentation following pediatric concussion: a PedCARE+MRI substudy - Sicard V, Fang Z, Kardish R, Healey K, Smith AM, Reid S, Cron GO, Melkus G, Abdeen N, Yeates KO, Goldfield G, Reed N, Zemek R, Ledoux AA. J. Neurotrauma 2024; ePub(ePub): ePub. Making it count - tracing signs of consciousness and potentiality in severe brain injury in Denmark","Høybye MT, Andersen LM, Boelsbjerg HB",Med. Anthropol.,2024,https://www.safetylit.org/week/2024/240121.pdf,240121,281,281,2025-09-06T21:16:57.312222
